name,id,tier,rarity,tags,base value,unlocked,hidden,hiddenEverywhere,cost_frigate,cost_dest,cost_cruiser,cost_capital,script,desc,sprite
Biosphere,biosphere,1,0,,999999,FALSE,TRUE,,0,0,0,0,data.hullmods.TheNomadsBiosphere,"An onboard closed ecosystem used to grow assorted flora and fauna, and provide necessities for long-term journeys. Reduces externally-sourced supply consumption to near-zero.",graphics/nom/hullmods/biosphere.png
Cloning Vats,cloning_vats,1,0,,999999,FALSE,TRUE,,0,0,0,0,data.hullmods.TheNomadsCloningVats,Installs a delicate system of sealed cellular vats used in fast-maturation human cloning. Produces green crew at regular intervals.,graphics/nom/hullmods/cloning_vats.png
Nanobot Fabricators,automated_nanobot_fabricators,1,0,,999999,FALSE,TRUE,,0,0,0,0,data.hullmods.TheNomadsAutomatedNanobotFabricators,"Allows for the remote instruction of nanoscale robots, used in an industrial-scale parts fabrication and assembly factory. Produces supplies at regular intervals.",graphics/nom/hullmods/automated_nanobot_fabricators.png
Logistical Drone Control,logistical_distribution_drones,1,0,,999999,FALSE,TRUE,,0,0,0,0,data.hullmods.TheNomadsLogisticalDistributionDrones,"Provides mechanical assistance with near-range interfleet supply transfers, and eases the storage and organization requirements associated with large fleet logistics operations.",graphics/nom/hullmods/logistical_distribution_drones.png
Naeran Flux Shunts,naeran_flux_shunts,1,0,,999999,FALSE,TRUE,,0,0,0,0,data.hullmods.TheNomadsNaeranFluxShunts,"Ancient Naeran technology that provides all Nomad ships with a way to dissipate flux internally by converting it into multi-spectrum EM radiation. Required for basic functioning of Nomad weapon systems, and not compatible with modern ships or technology due to its outdated design.",graphics/nom/hullmods/naeran_flux_shunts.png
Royal,nomad_royal,1,0,,999999,FALSE,TRUE,,0,0,0,0,data.hullmods.TheNomadsRoyal,"The Nomad Royal Escort fleets make use of modified ships; they generally have higher engine output and weapon targeting range; the exact methods & specifications of the modifications are a closely-guarded Nomad military secret, but they are extensive enough that they cannot be performed outside of drydock. They may not even be fully known to the Nomads themselves, anymore, or they may now lack appropriate facilities, but the Armada would never admit this.",graphics/nom/hullmods/royal.png
